"Status","Start Time","Stop Time","Duration in ms","Parent Suite","Suite","Sub Suite","Test Class","Test Method","Name","Description"
"passed","Wed Mar 12 07:07:38 GMT 2025","Wed Mar 12 07:07:43 GMT 2025","5021","","com.jetbrains.teamcity.ui.FindProjectByNameTest","","com.jetbrains.teamcity.ui.FindProjectByNameTest","a user should be able to find a project by name","a user should be able to find a project by name()",""
"passed","Wed Mar 12 07:07:16 GMT 2025","Wed Mar 12 07:07:22 GMT 2025","6030","","com.jetbrains.teamcity.ui.CreateBuildTypeTest","","com.jetbrains.teamcity.ui.CreateBuildTypeTest","a user should not be able to create a build type without a name","a user should not be able to create a build type without a name()",""
"passed","Wed Mar 12 07:07:22 GMT 2025","Wed Mar 12 07:07:31 GMT 2025","9058","","com.jetbrains.teamcity.ui.CreateProjectTest","","com.jetbrains.teamcity.ui.CreateProjectTest","a user should be able to create a project","a user should be able to create a project()",""
"passed","Wed Mar 12 07:06:30 GMT 2025","Wed Mar 12 07:06:30 GMT 2025","758","","com.jetbrains.teamcity.api.SetUpAgentTest","","com.jetbrains.teamcity.api.SetUpAgentTest","authorizeDefaultAgent","authorizeDefaultAgent()",""
"passed","Wed Mar 12 07:07:43 GMT 2025","Wed Mar 12 07:07:54 GMT 2025","10316","","com.jetbrains.teamcity.ui.StartBuildTest","","com.jetbrains.teamcity.ui.StartBuildTest","a user should be able to start a successful build","a user should be able to start a successful build()",""
"passed","Wed Mar 12 07:07:08 GMT 2025","Wed Mar 12 07:07:16 GMT 2025","7560","","com.jetbrains.teamcity.ui.CreateBuildTypeTest","","com.jetbrains.teamcity.ui.CreateBuildTypeTest","a user should not be able to create a build type without a branch","a user should not be able to create a build type without a branch()",""
"passed","Wed Mar 12 07:06:35 GMT 2025","Wed Mar 12 07:07:08 GMT 2025","33478","","com.jetbrains.teamcity.ui.CreateBuildTypeTest","","com.jetbrains.teamcity.ui.CreateBuildTypeTest","a user should be able to create a build type","a user should be able to create a build type()",""
"passed","Wed Mar 12 07:07:31 GMT 2025","Wed Mar 12 07:07:38 GMT 2025","7532","","com.jetbrains.teamcity.ui.CreateProjectTest","","com.jetbrains.teamcity.ui.CreateProjectTest","a user should not be able to create a project without a name","a user should not be able to create a project without a name()",""
